{
  "id": "11111111-2222-3333-4444-555555555555",
  "requisitionNumber": "REQ-100245",
  "title": "Senior Software Engineer",
  "status": "Open",
  "jobProfile": {
    "id": "11111111-2222-3333-4444-555555555555",
    "descriptor": "Senior Software Engineer"
  },
  "supervisoryOrganization": {
    "id": "11111111-2222-3333-4444-555555555555",
    "descriptor": "Senior Software Engineer"
  },
  "hiringManager": {
    "id": "11111111-2222-3333-4444-555555555555",
    "descriptor": "Senior Software Engineer"
  },
  "linkedJobRequisitions": [
    {
      "id": "11111111-2222-3333-4444-555555555555",
      "descriptor": "Senior Software Engineer"
    }
  ],
  "createdOn": "2026-05-03T14:30:00Z"
}
